title,site_url,description,publication_icon,nsfw,categories,member_count,show_member_count,mrr,show_mrr,ghost_rank,featured,feature_image,text_color,bg_color,accent_color,lang,created_at,mrr_members_rank,mrr_members_diff_rank,updated_at,showIframe,objectID
Belief Hole Podcast,https://expansion.beliefhole.com/,"Official members-only site for the paranormal podcast ""Belief Hole"" - three brothers covering the strangest stories, theories, and lore permeating our weird wonderful world.",https://supapjpiqdfzuaordcdx.supabase.co/storage/v1/render/image/public/images/1667614328723-Belief-Hole-Paranormal-Podcast-Logo-500--compressed.png?width=75&height=75&resize=contain,False,['podcasts'],2341,True,9K,True,1061972,False,,,,#eb041c,en,1658238539,96762.1,12,1706724072,True,b54bf245-1823-46ec-a069-f4bbd0ae2bf0
overflo.,https://www.overflo.co/,overflo is a multimedia learning and development platform for mystics supporting wholeness through sacred Self discovery.  ,https://supapjpiqdfzuaordcdx.supabase.co/storage/v1/render/image/public/images/1704300977804-favicon-overflo-1.png?width=75&height=75&resize=contain,False,['podcasts'],832,True,,False,386380309,False,,,,#627246,en,1704300978,832,0,1702149259,True,af9eebbb-f9ce-4353-9b0d-1962a2386681
"Give 'Em Hell, Brigham",https://giveemhellbrigham.com/,"A freemium podcast, newsletter, & Discord community for the in depth, off brand, BYU fan",https://supapjpiqdfzuaordcdx.supabase.co/storage/v1/render/image/public/images/1689878579775-square_png_logo.png?width=75&height=75&resize=contain,False,['podcasts'],783,True,,False,3861075,False,,,,#0062b8,en,1689878580,783,0,1706652137,False,ad2f7c3d-695f-44bf-803f-c99f5b3a9e18
A&T Media,https://www.at-media-group.com/,"We specialise in the creation of audio content, in the form of podcasts. A&T Media generates English-language podcasts that are geared towards the Middle East region.",https://supapjpiqdfzuaordcdx.supabase.co/storage/v1/render/image/public/images/1680567067738-What%20I%20Did%20Next.png?width=75&height=75&resize=contain,False,['podcasts'],344,True,,False,5879956,False,,,,#FF1A75,en,1678099691,344,2,1702893635,True,e4899028-8275-449c-acb3-d8372128db6d
Amaeya Media,https://amaeya.media/,"We empower conversations that help humanise our world. Over the last 4 years, over 300,000 people have listened through 13,500 minutes of powerful audio conversations and stories on our Network.",https://supapjpiqdfzuaordcdx.supabase.co/storage/v1/render/image/public/images/1660222037000-Open-quote---orange.png?width=75&height=75&resize=contain,False,['podcasts'],206,True,,False,4651950,False,,,,#4D0E4F,en,1660131425,206,22,1706772648,True,3edd15ce-730d-463e-a93d-9181d9b78e48
Let the Verse Flow,https://www.lettheverseflow.com/,"A mashup of stories + poetry + music that uses creativity as a catalyst for finding more peace, positivity, and personal fulfillment. ",https://supapjpiqdfzuaordcdx.supabase.co/storage/v1/render/image/public/images/1692984058278-Untitled-design--10-.png?width=75&height=75&resize=contain,False,['podcasts'],197,True,,False,79887753,False,,,,#662D66,en,1692984059,197,0,1706714246,True,bb958d4e-af95-44dd-bbec-513f98bb6f5d
Business Games,https://www.business-games.ai/,"Understand Humans, Make Better Decisions: Business, Information, Wars",https://supapjpiqdfzuaordcdx.supabase.co/storage/v1/render/image/public/images/1699859829611-Asset-3.png?width=75&height=75&resize=contain,False,['podcasts'],115,True,,False,22146774,False,,,,#00B6ED,en,1670991842,115,0,1697337545,True,adb20785-d9c3-4ad1-8a4e-ec0051d57f1f
Agripreneurs,https://www.agripreneurs.in/,"Agripreneurs.in fosters a diverse, dynamic community through collaborative agricultural entrepreneurship activities. Join us in sparking progress.",https://supapjpiqdfzuaordcdx.supabase.co/storage/v1/render/image/public/images/1688191270407-favicon.png?width=75&height=75&resize=contain,False,['podcasts'],73,True,0,True,10999927,False,,,,#1F9C21,en,1688191271,73,2,1688122757,True,7c29a769-59f5-43ba-a418-335a272b89ba
The Memeing of Life,https://www.thememeingof.life/,How to navigate through the hellscape.,https://supapjpiqdfzuaordcdx.supabase.co/storage/v1/render/image/public/images/1674276533593-The-Memeing-of-Life-Favicon.png?width=75&height=75&resize=contain,False,['podcasts'],7,True,0,True,9999993,False,,,,#127991,en,1674276534,7,0,1679964611,True,a4b9b219-2788-43c3-9778-7b897f65d1d7
Best of the Worst,https://villains.lol/,The most ridiculous villains in comic book history.,https://supapjpiqdfzuaordcdx.supabase.co/storage/v1/render/image/public/images/1679576839225-botw3-site-favicon.png?width=75&height=75&resize=contain,False,['podcasts'],7,True,0,True,12941051,False,,,,#86413a,en,1677765034,7,1,1682578840,True,61a26ea1-5869-4b7f-8c6c-c459adcc8797
Modern Gays,https://www.moderngays.co/,"Build the vibrant life you want by owning your authentic self. Online magazine, newsletter and podcast about and for the LGBTQ+ community.",https://supapjpiqdfzuaordcdx.supabase.co/storage/v1/render/image/public/images/1706843038761-modern-gays.png?width=75&height=75&resize=contain,False,['podcasts'],4,True,0,True,110141800,False,,,,#8e5ade,en,1701659209,4,0,1706845183,True,2e752626-32c5-42e7-9955-933dc2edddcd
Secular Buddhism Podcast,https://secularbuddhism.com/,Combining Buddhist Philosophy + Psychology + Neuroscience. Learn how to incorporate mindfulness into your everyday life.,https://supapjpiqdfzuaordcdx.supabase.co/storage/v1/render/image/public/images/1691627916820-SB-Simple.png?width=75&height=75&resize=contain,False,['podcasts'],0,False,,False,1005127,False,,,,#ff6200,en,1691627917,0,0,1706460368,True,1cd14e9c-02a6-4742-a64f-064e022e6f64
Analyse Asia,https://www.analyse.asia/,"The Premiere Podcast dissecting the pulse of Business, Technology & Media in Asia",https://supapjpiqdfzuaordcdx.supabase.co/storage/v1/render/image/public/images/1695637612284-Square-logo.png?width=75&height=75&resize=contain,False,['podcasts'],0,False,,False,1589412,False,,,,#8c1aff,en,1671234500,0,0,1706652921,True,1603116d-90b4-4bb9-b2b0-48e27f102792
The Sextracurricular Podcast,https://sextracurricular.com/,"An honest blog and podcast from a married couple exploring the ethical, consensual, sexual non-monogamy lifestyle. Episodes are available on Apple Podcasts, Spotify, and all other major platforms!",https://supapjpiqdfzuaordcdx.supabase.co/storage/v1/render/image/public/images/1677896673502-Sextracurricular---Tiny-3.jpg?width=75&height=75&resize=contain,True,['podcasts'],0,False,,False,2444489,False,,,,#5ce1e6,en,1677896674,0,0,1706699231,False,ff2ef02b-19f5-4e59-a00e-275e921e9a15
The Joe Walker Podcast,https://josephnoelwalker.com/,"Joe Walker hosts refreshingly in-depth conversations with founders, scientists, scholars, economists, and public intellectuals.",https://supapjpiqdfzuaordcdx.supabase.co/storage/v1/render/image/public/images/1705016112098-jsp-favicon.png?width=75&height=75&resize=contain,False,['podcasts'],0,False,,False,2686046,False,,,,#FF452C,en,1705016113,0,0,1704952728,True,2c3457b7-604f-4449-88f1-673e62adb77d
Podcast Disclosed ,https://podcastdisclosed.com/,"Read Summaries and Notes of World's top Podcasts. On Purpose with Jay Shetty, Huberman Lab, The Mindset Mentor and many more . Reachout to us at hello@podcastdisclosed.com",https://supapjpiqdfzuaordcdx.supabase.co/storage/v1/render/image/public/images/1682448055691-Copy-of-Home-Design--3-.png?width=75&height=75&resize=contain,False,['podcasts'],0,False,0,True,9790671,False,,,,#FEF203,en,1668067057,0,0,1706847635,True,852e3898-f026-475d-9be9-c1d515bd65c4
Eco Punks,https://ecopunks.live/,Understanding Ecosystems with Attitude,https://supapjpiqdfzuaordcdx.supabase.co/storage/v1/render/image/public/images/1705625814288-punk_goat.ico?width=75&height=75&resize=contain,False,['podcasts'],0,False,,False,10500000,False,,,,#990000,en,1705625815,0,0,1705595260,True,82e65a5e-e646-488f-aa8e-8ad893921792
The Huge Blog,https://huge.fm/blog/,Learn about private podcasting.,https://supapjpiqdfzuaordcdx.supabase.co/storage/v1/render/image/public/images/1696596368859-favicon.png?width=75&height=75&resize=contain,False,['podcasts'],0,False,,False,10500000,False,,,,#2e2e2e,en,1696596369,0,0,1705518092,False,7f7b236c-b424-4aac-80be-3ed5805f4d43
Mad Pony Show,https://www.madponyshow.com/,A podcast about nothing and everything.,https://supapjpiqdfzuaordcdx.supabase.co/storage/v1/render/image/public/images/1678145339970-Mad%20Pony%20Show%20-%20Artwork_Cover%20Art.jpg?width=75&height=75&resize=contain,False,['podcasts'],0,False,,False,11000000,False,,,,#fe546f,en,1678145341,0,0,1677873688,True,ad4835d3-4ade-4a2d-be78-29066c12411b
Just Books,https://welshauthor.com/,"This podcast is all about books, writing books, and book reviews. The episodes, which appear weekly, are written either by Owen Jones, a prolific writer or Chalita Majang, an avid reader. ",https://supapjpiqdfzuaordcdx.supabase.co/storage/v1/render/image/public/images/1695642396761-Podcast_logo-3kx3k-1.jpg?width=75&height=75&resize=contain,False,['podcasts'],0,False,,False,67002219,False,,,,#fda968,en-gb,1695642398,0,0,1696489986,True,30c40a60-2bdb-475c-9e5f-9ee4221b4bec
Darwin Gefällt Das,https://darwingefaelltdas.de/,Der History Podcast über die Epic Fails der Menschheitsgeschichte,https://supapjpiqdfzuaordcdx.supabase.co/storage/v1/render/image/public/images/1695131382752-favicon.ico?width=75&height=75&resize=contain,False,['podcasts'],0,False,,False,119611993,False,,,,#85bbc5,de,1695131384,0,0,1705588561,True,3ace9699-bd57-47e7-9419-0f3035aa43b4
